<?xml version='1.0' encoding='utf-8'?>
<diff xmlns:xsi="http://www.w3.org/2001/XMLSchema-instance" xsi:noNamespaceSchemaLocation="../../xsd/librariesdiff.xsd">
  <remove sel="/defaults/dataset[@macro='swi_clusteradarlon_macro']/properties/area/@factionlogic" />
  <remove sel="/defaults/dataset[@macro='swi_clustercelesta_macro']/properties/area/@factionlogic" />
  <remove sel="/defaults/dataset[@macro='swi_clusterdagobah_macro']/properties/area/@factionlogic" />
  <remove sel="/defaults/dataset[@macro='swi_clusterdelrakinn_macro']/properties/area/@factionlogic" />
  <remove sel="/defaults/dataset[@macro='swi_clusterfirrerre_macro']/properties/area/@factionlogic" />
  <remove sel="/defaults/dataset[@macro='swi_clustergaulus_macro']/properties/area/@factionlogic" />
  <remove sel="/defaults/dataset[@macro='swi_clusterimynusoph_macro']/properties/area/@factionlogic" />
  <remove sel="/defaults/dataset[@macro='swi_clusterkalee_macro']/properties/area/@factionlogic" />
  <remove sel="/defaults/dataset[@macro='swi_clusterkuna_macro']/properties/area/@factionlogic" />
  <remove sel="/defaults/dataset[@macro='swi_clustermanaan_macro']/properties/area/@factionlogic" />
  <remove sel="/defaults/dataset[@macro='swi_clustermillagro_macro']/properties/area/@factionlogic" />
  <remove sel="/defaults/dataset[@macro='swi_clustermytus_macro']/properties/area/@factionlogic" />
  <remove sel="/defaults/dataset[@macro='swi_clusterpolismassa_macro']/properties/area/@factionlogic" />
  <remove sel="/defaults/dataset[@macro='swi_clusterrentasia_macro']/properties/area/@factionlogic" />
  <remove sel="/defaults/dataset[@macro='swi_clustersaleucami_macro']/properties/area/@factionlogic" />
  <remove sel="/defaults/dataset[@macro='swi_clustersmugglersrun_macro']/properties/area/@factionlogic" />
  <remove sel="/defaults/dataset[@macro='swi_clustertargonn_macro']/properties/area/@factionlogic" />
  <remove sel="/defaults/dataset[@macro='swi_clustertriton_macro']/properties/area/@factionlogic" />
  <remove sel="/defaults/dataset[@macro='swi_clusteruyter_macro']/properties/area/@factionlogic" />
  <remove sel="/defaults/dataset[@macro='swi_clusterwrea_macro']/properties/area/@factionlogic" />

  <add sel="//dataset[@macro='swi_clustercrustai_macro']/properties/area" type="@tags">nopirates</add>
  <add sel="//dataset[@macro='swi_clustermaw_macro']/properties/area" type="@tags">nopirates guardian</add>
  <add sel="//dataset[@macro='swi_clusterordoplutonia_macro']/properties/area" type="@tags">nopirates guardian</add>
  <add sel="//dataset[@macro='swi_clustersump_macro']/properties/area" type="@tags">nopirates guardian</add>
  <add sel="//dataset[@macro='swi_clusteratrisia_macro']/properties/area" type="@tags">nopirates guardian</add>
  <add sel="//dataset[@macro='swi_clusteranteevy_macro']/properties/area" type="@tags">nopirates guardian</add>
  <add sel="//dataset[@macro='swi_clusterbaros_macro']/properties/area" type="@tags">nopirates guardian</add>
  <add sel="//dataset[@macro='swi_clustermorellia_macro']/properties/area" type="@tags">nopirates guardian</add>
  <add sel="//dataset[@macro='swi_clusterur3_macro']/properties/area" type="@tags">nopirates guardian</add>

  <!-- guardian sectors
  <remove sel="/defaults/dataset[@macro='swi_clustermaw_macro']/properties/area/@factionlogic" />
  <remove sel="/defaults/dataset[@macro='swi_clusterordoplutonia_macro']/properties/area/@factionlogic" />
  <remove sel="/defaults/dataset[@macro='swi_clustersump_macro']/properties/area/@factionlogic" />
  <remove sel="/defaults/dataset[@macro='swi_clusteratrisia_macro']/properties/area/@factionlogic" />
  <remove sel="/defaults/dataset[@macro='swi_clusteranteevy_macro']/properties/area/@factionlogic" />
  <remove sel="/defaults/dataset[@macro='swi_clusterbaros_macro']/properties/area/@factionlogic" />
  <remove sel="/defaults/dataset[@macro='swi_clustermorellia_macro']/properties/area/@factionlogic" />
  -->

  <add sel="//dataset[@macro='swi_clustercrustai_macro']/properties">
    <system>
      <planets>
        <planet part="Sphere002">
          <moons>
            <moon part="Sphere003" />
          </moons>
        </planet>
      </planets>
    </system>
  </add>
  <add sel="//dataset[@macro='swi_clusterlahmu_macro']/properties">
    <system>
      <planets>
        <planet part="part_earthlike">
          <moons>
            <moon part="moon" />
            <moon part="moon002" />
          </moons>
        </planet>
      </planets>
    </system>
  </add>
  <add sel="//dataset[@macro='swi_clustercoruscant_macro']/properties">
    <system>
      <planets>
        <planet part="planet_coruscant">
        </planet>
      </planets>
    </system>
  </add>
  <add sel="//dataset[@macro='swi_clustermandalore_macro']/properties">
    <system>
      <planets>
        <planet part="part_oof_planet">
          <moons>
            <moon part="Sphere003" />
          </moons>
        </planet>
      </planets>
    </system>
  </add>
  <add sel="//dataset[@macro='swi_clusterhypori_macro']/properties">
    <system>
      <planets>
        <planet part="Sphere001">
          <moons>
            <moon part="planet001b" />
          </moons>
        </planet>
      </planets>
    </system>
  </add>
  <add sel="//dataset[@macro='swi_clustercantonica_macro']/properties">
    <system>
      <planets>
        <planet part="part_earthlike">
          <moons>
            <moon part="moon" />
          </moons>
        </planet>
      </planets>
    </system>
  </add>
  <add sel="//dataset[@macro='swi_clusteranpath_macro']/properties">
    <system>
      <planets>
        <planet part="part_earthlike">
          <moons>
            <moon part="moon" />
            <moon part="part_earthlike001" />
          </moons>
        </planet>
      </planets>
    </system>
  </add>
  <add sel="//dataset[@macro='swi_clustereriadu_macro']/properties">
    <system>
      <planets>
        <planet part="part_earthlike">
          <moons>
            <moon part="moon" />
          </moons>
        </planet>
      </planets>
    </system>
  </add>
  <add sel="//dataset[@macro='swi_clusternarshadda_macro']/properties">
    <system>
      <planets>
        <planet part="planet_nar_shaddaa">
        </planet>
      </planets>
    </system>
  </add>
  <add sel="//dataset[@macro='swi_clusterhapes_macro']/properties">
    <system>
      <planets>
        <planet part="moon">
        </planet>
      </planets>
    </system>
  </add>
  <add sel="//dataset[@macro='swi_clusterkamino_macro']/properties">
    <system>
      <planets>
        <planet part="part_earthlike">
        </planet>
      </planets>
    </system>
  </add>
  <add sel="//dataset[@macro='swi_clusternaboo_macro']/properties">
    <system>
      <planets>
        <planet part="planet001">
        </planet>
      </planets>
    </system>
  </add>
  <add sel="//dataset[@macro='swi_clusterkorriban_macro']/properties">
    <system>
      <planets>
        <planet part="planet_korriban">
        </planet>
      </planets>
    </system>
  </add>
</diff>